    1 0.000000000 192.168.0.173 → 151.101.38.132 TCP 66 60270 → 443 [ACK] Seq=1 Ack=1 Win=501 Len=0 TSval=1807671337 TSecr=384027232
    2 8.746805033 192.168.0.173 → 152.19.134.41 TCP 74 58470 → 443 [SYN] Seq=0 Win=64240 Len=0 MSS=1460 SACK_PERM=1 TSval=2000735667 TSecr=0 WS=128
    3 8.907687173 192.168.0.173 → 152.19.134.41 TCP 74 58476 → 443 [SYN] Seq=0 Win=64240 Len=0 MSS=1460 SACK_PERM=1 TSval=2000735828 TSecr=0 WS=128
    4 8.990031715 192.168.0.173 → 152.19.134.41 TCP 66 58470 → 443 [ACK] Seq=1 Ack=1 Win=64256 Len=0 TSval=2000735910 TSecr=1225441389
    5 8.990491439 192.168.0.173 → 152.19.134.41 TLSv1 583 Client Hello
    6 9.134006672 192.168.0.173 → 152.19.134.41 TCP 66 58476 → 443 [ACK] Seq=1 Ack=1 Win=64256 Len=0 TSval=2000736054 TSecr=1225441551
    7 9.134401728 192.168.0.173 → 152.19.134.41 TLSv1 583 Client Hello
    8 9.227580697 192.168.0.173 → 152.19.134.41 TCP 66 58470 → 443 [ACK] Seq=518 Ack=1369 Win=63104 Len=0 TSval=2000736148 TSecr=1225441628
    9 9.227617665 192.168.0.173 → 152.19.134.41 TCP 66 58470 → 443 [ACK] Seq=518 Ack=2737 Win=61824 Len=0 TSval=2000736148 TSecr=1225441628
   10 9.227633247 192.168.0.173 → 152.19.134.41 TCP 66 58470 → 443 [ACK] Seq=518 Ack=4097 Win=60544 Len=0 TSval=2000736148 TSecr=1225441628
   11 9.228117084 192.168.0.173 → 152.19.134.41 TCP 66 58470 → 443 [ACK] Seq=518 Ack=5465 Win=63104 Len=0 TSval=2000736148 TSecr=1225441629
   12 9.228136645 192.168.0.173 → 152.19.134.41 TCP 66 58470 → 443 [ACK] Seq=518 Ack=5749 Win=62848 Len=0 TSval=2000736148 TSecr=1225441629
   13 9.228753314 192.168.0.173 → 152.19.134.41 TLSv1.2 130 Change Cipher Spec, Application Data
   14 9.229029370 192.168.0.173 → 152.19.134.41 TLSv1.2 164 Application Data
   15 9.229854741 192.168.0.173 → 152.19.134.41 TLSv1.2 612 Application Data
   16 9.357967078 192.168.0.173 → 152.19.134.41 TCP 66 58476 → 443 [ACK] Seq=518 Ack=239 Win=64128 Len=0 TSval=2000736278 TSecr=1225441770
   17 9.358557275 192.168.0.173 → 152.19.134.41 TLSv1.2 130 Change Cipher Spec, Application Data
   18 9.459377798 192.168.0.173 → 152.19.134.41 TCP 66 58470 → 443 [ACK] Seq=1226 Ack=5907 Win=64128 Len=0 TSval=2000736379 TSecr=1225441860
   19 9.468180609 192.168.0.173 → 152.19.134.41 TLSv1.2 97 Application Data
   20 9.470348985 192.168.0.173 → 152.19.134.41 TLSv1.2 101 Application Data
   21 9.632012421 192.168.0.173 → 152.19.134.41 TCP 66 58476 → 443 [ACK] Seq=582 Ack=318 Win=64128 Len=0 TSval=2000736552 TSecr=1225442007
   22 14.782442044 192.168.0.173 → 34.111.80.201 TCP 74 40240 → 443 [SYN] Seq=0 Win=64240 Len=0 MSS=1460 SACK_PERM=1 TSval=1810445134 TSecr=0 WS=128
   23 14.815189996 192.168.0.173 → 34.111.80.201 TCP 66 40240 → 443 [ACK] Seq=1 Ack=1 Win=64256 Len=0 TSval=1810445166 TSecr=2165914750
   24 14.815800575 192.168.0.173 → 34.111.80.201 TLSv1 664 Client Hello
   25 14.960000680 192.168.0.173 → 34.111.80.201 TCP 66 40240 → 443 [ACK] Seq=599 Ack=213 Win=64128 Len=0 TSval=1810445311 TSecr=2165914897
   26 14.960341874 192.168.0.173 → 34.111.80.201 TLSv1.2 130 Change Cipher Spec, Application Data
   27 15.047984232 192.168.0.173 → 34.111.80.201 TCP 66 40240 → 443 [ACK] Seq=663 Ack=799 Win=64128 Len=0 TSval=1810445399 TSecr=2165914940
   28 18.416052095 192.168.0.173 → 151.101.129.69 TCP 66 59606 → 443 [ACK] Seq=1 Ack=1 Win=694 Len=0 TSval=3232846006 TSecr=491581976
   29 19.668234961 192.168.0.173 → 13.64.73.29  TCP 74 39334 → 443 [SYN] Seq=0 Win=64240 Len=0 MSS=1460 SACK_PERM=1 TSval=3190723636 TSecr=0 WS=128
   30 19.668370189 192.168.0.173 → 13.64.73.29  TCP 74 39336 → 443 [SYN] Seq=0 Win=64240 Len=0 MSS=1460 SACK_PERM=1 TSval=3190723636 TSecr=0 WS=128
