    1 0.000000000 192.168.0.173 → 216.58.223.206 TCP 66 46572 → 443 [ACK] Seq=1 Ack=1 Win=501 Len=0 TSval=2649681995 TSecr=179103363
    2 26.962776408 192.168.0.173 → 216.58.223.206 TCP 66 [TCP Previous segment not captured] 46572 → 443 [FIN, ACK] Seq=2 Ack=1 Win=501 Len=0 TSval=2649708958 TSecr=179148451
    3 27.023993578 192.168.0.173 → 143.204.192.146 TCP 74 38210 → 443 [SYN] Seq=0 Win=64240 Len=0 MSS=1460 SACK_PERM=1 TSval=347557352 TSecr=0 WS=128
    4 27.035768965 192.168.0.173 → 216.58.223.206 TCP 66 46572 → 443 [ACK] Seq=3 Ack=2 Win=501 Len=0 TSval=2649709031 TSecr=179175419
    5 27.181941677 192.168.0.173 → 143.204.192.146 TCP 66 38210 → 443 [ACK] Seq=1 Ack=1 Win=64256 Len=0 TSval=347557510 TSecr=3904607700
    6 27.182415984 192.168.0.173 → 143.204.192.146 TLSv1 583 Client Hello
    7 27.353805583 192.168.0.173 → 143.204.192.146 TCP 66 38210 → 443 [ACK] Seq=518 Ack=235 Win=64128 Len=0 TSval=347557682 TSecr=3904607872
    8 27.360379317 192.168.0.173 → 143.204.192.146 TLSv1.2 130 Change Cipher Spec, Application Data
    9 27.360677507 192.168.0.173 → 143.204.192.146 TLSv1.2 164 Application Data
   10 27.363347600 192.168.0.173 → 143.204.192.146 TLSv1.2 487 Application Data
   11 27.364697028 192.168.0.173 → 143.204.192.146 TCP 66 [TCP Dup ACK 7#1] 38210 → 443 [ACK] Seq=1101 Ack=235 Win=64128 Len=0 TSval=347557693 TSecr=3904607872
   12 27.502031997 192.168.0.173 → 143.204.192.146 TCP 66 38210 → 443 [ACK] Seq=1101 Ack=452 Win=64128 Len=0 TSval=347557830 TSecr=3904608021
   13 27.502337199 192.168.0.173 → 143.204.192.146 TLSv1.2 97 Application Data
   14 27.512341493 192.168.0.173 → 143.204.192.146 TLSv1.2 101 Application Data
   15 73.664004907 192.168.0.173 → 143.204.192.146 TCP 66 [TCP Keep-Alive] 38210 → 443 [ACK] Seq=1166 Ack=791 Win=64128 Len=0 TSval=347603992 TSecr=3904608180
   16 118.843967046 192.168.0.173 → 143.204.192.146 TCP 66 [TCP Keep-Alive] 38210 → 443 [ACK] Seq=1166 Ack=791 Win=64128 Len=0 TSval=347649172 TSecr=3904654345
   17 165.824000915 192.168.0.173 → 143.204.192.146 TCP 66 [TCP Keep-Alive] 38210 → 443 [ACK] Seq=1166 Ack=791 Win=64128 Len=0 TSval=347696152 TSecr=3904699545
   18 178.118045315 192.168.0.173 → 13.64.73.29  TCP 74 41668 → 443 [SYN] Seq=0 Win=64240 Len=0 MSS=1460 SACK_PERM=1 TSval=830598046 TSecr=0 WS=128
   19 178.136293104 192.168.0.173 → 34.111.80.201 TCP 74 45860 → 443 [SYN] Seq=0 Win=64240 Len=0 MSS=1460 SACK_PERM=1 TSval=3565983436 TSecr=0 WS=128
   20 178.226979407 192.168.0.173 → 13.64.73.29  TCP 74 41684 → 443 [SYN] Seq=0 Win=64240 Len=0 MSS=1460 SACK_PERM=1 TSval=830598155 TSecr=0 WS=128
   21 178.282182182 192.168.0.173 → 34.111.80.201 TCP 66 45860 → 443 [ACK] Seq=1 Ack=1 Win=64256 Len=0 TSval=3565983582 TSecr=2870899679
   22 178.282379470 192.168.0.173 → 34.111.80.201 TLSv1 664 Client Hello
   23 178.365653795 192.168.0.173 → 13.64.73.29  TCP 74 41698 → 443 [SYN] Seq=0 Win=64240 Len=0 MSS=1460 SACK_PERM=1 TSval=830598294 TSecr=0 WS=128
   24 178.397237046 192.168.0.173 → 13.64.73.29  TCP 66 41668 → 443 [ACK] Seq=1 Ack=1 Win=64256 Len=0 TSval=830598325 TSecr=2241448396
   25 178.397552666 192.168.0.173 → 13.64.73.29  TLSv1 583 Client Hello
