    1 0.000000000 192.168.43.66 → 34.120.160.131 TCP 66 39790 → 443 [ACK] Seq=1 Ack=1 Win=501 Len=0 TSval=1784347827 TSecr=3270223611
    2 6.911985761 192.168.43.66 → 52.4.82.57   TCP 66 55524 → 443 [ACK] Seq=1 Ack=1 Win=501 Len=0 TSval=2343617200 TSecr=4131796587
    3 6.996020330 192.168.43.66 → 143.204.192.59 TCP 66 39992 → 443 [ACK] Seq=1 Ack=1 Win=501 Len=0 TSval=3372045007 TSecr=2488602607
    4 14.389148878 192.168.43.66 → 34.120.160.131 TLSv1.2 95 [TCP Previous segment not captured] , Application Data
    5 17.663989929 192.168.43.66 → 75.2.53.94   TCP 66 58368 → 443 [ACK] Seq=1 Ack=1 Win=501 Len=0 TSval=917778335 TSecr=3596828954
    6 21.956124806 192.168.43.66 → 52.4.82.57   TCP 78 [TCP Previous segment not captured] 55524 → 443 [ACK] Seq=2 Ack=1 Win=501 Len=0 TSval=2343632244 TSecr=4131842296 SLE=78 SRE=79
    7 22.212394121 192.168.43.66 → 52.4.82.57   TCP 66 55524 → 443 [ACK] Seq=2 Ack=79 Win=501 Len=0 TSval=2343632501 TSecr=4131857350
    8 22.212604928 192.168.43.66 → 52.4.82.57   TCP 66 55524 → 443 [FIN, ACK] Seq=2 Ack=79 Win=501 Len=0 TSval=2343632501 TSecr=4131857350
    9 22.660939777 192.168.43.66 → 216.58.223.197 TCP 74 50380 → 443 [SYN] Seq=0 Win=64240 Len=0 MSS=1460 SACK_PERM=1 TSval=2475110935 TSecr=0 WS=128
   10 22.700404445 192.168.43.66 → 216.58.223.197 TCP 74 50382 → 443 [SYN] Seq=0 Win=64240 Len=0 MSS=1460 SACK_PERM=1 TSval=2475110975 TSecr=0 WS=128
   11 22.820342441 192.168.43.66 → 216.58.223.197 TCP 66 50380 → 443 [ACK] Seq=1 Ack=1 Win=64256 Len=0 TSval=2475111095 TSecr=2542008246
   12 22.820794566 192.168.43.66 → 216.58.223.197 TLSv1 833 Client Hello
   13 22.847249797 192.168.43.66 → 216.58.223.197 TCP 66 50382 → 443 [ACK] Seq=1 Ack=1 Win=64256 Len=0 TSval=2475111122 TSecr=4125979471
   14 22.847696822 192.168.43.66 → 216.58.223.197 TLSv1 833 Client Hello
   15 23.359993452 192.168.43.66 → 216.58.223.197 TCP 833 [TCP Retransmission] 50382 → 443 [PSH, ACK] Seq=1 Ack=1 Win=64256 Len=767 TSval=2475111634 TSecr=4125979471
   16 23.428383355 192.168.43.66 → 216.58.223.197 TCP 66 50382 → 443 [ACK] Seq=768 Ack=377 Win=64000 Len=0 TSval=2475111703 TSecr=4125979711
   17 23.429071551 192.168.43.66 → 216.58.223.197 TCP 66 50380 → 443 [ACK] Seq=768 Ack=377 Win=64000 Len=0 TSval=2475111703 TSecr=2542008541
   18 23.429115953 192.168.43.66 → 216.58.223.197 TLSv1.2 140 Change Cipher Spec, Application Data
   19 23.429912497 192.168.43.66 → 216.58.223.197 TLSv1.2 140 Change Cipher Spec, Application Data
   20 23.430874298 192.168.43.66 → 216.58.223.197 TCP 66 50380 → 443 [FIN, ACK] Seq=842 Ack=377 Win=64128 Len=0 TSval=2475111705 TSecr=2542008541
   21 23.434676714 192.168.43.66 → 216.58.223.197 TLSv1.2 164 Application Data
   22 23.435461093 192.168.43.66 → 216.58.223.197 TCP 1434 [TCP segment of a reassembled PDU]
   23 23.435467860 192.168.43.66 → 216.58.223.197 TLSv1.2 1288 Application Data
   24 23.436168693 192.168.43.66 → 216.58.223.197 TLSv1.2 391 Application Data
   25 23.551268052 192.168.43.66 → 216.58.223.197 TCP 54 50380 → 443 [RST] Seq=842 Win=0 Len=0
   26 23.551450567 192.168.43.66 → 216.58.223.197 TCP 78 [TCP Dup ACK 16#1] 50382 → 443 [ACK] Seq=3855 Ack=377 Win=64128 Len=0 TSval=2475111826 TSecr=4125980142 SLE=1 SRE=377
   27 23.551653886 192.168.43.66 → 216.58.223.197 TCP 54 50380 → 443 [RST] Seq=843 Win=0 Len=0
   28 23.872009188 192.168.43.66 → 216.58.223.197 TCP 391 [TCP Retransmission] 50382 → 443 [PSH, ACK] Seq=3530 Ack=377 Win=64128 Len=325 TSval=2475112146 TSecr=4125980142
   29 24.411846695 192.168.43.66 → 216.58.223.197 TCP 66 50382 → 443 [ACK] Seq=3855 Ack=1335 Win=63232 Len=0 TSval=2475112686 TSecr=4125980199
   30 24.411922278 192.168.43.66 → 216.58.223.197 TCP 66 50382 → 443 [ACK] Seq=3855 Ack=1366 Win=63232 Len=0 TSval=2475112686 TSecr=4125980199
