    1 0.000000000 192.168.0.173 → 109.107.38.233 TCP 66 41964 → 443 [ACK] Seq=1 Ack=1 Win=3134 Len=0 TSval=255733590 TSecr=566702336
    2 12.845108402 192.168.0.173 → 151.101.38.132 TLSv1.2 130 Application Data
    3 12.845160312 192.168.0.173 → 151.101.38.132 TLSv1.2 229 Application Data, Application Data
    4 12.848815531 192.168.0.173 → 143.204.191.85 TLSv1.2 131 Application Data
    5 12.851630265 192.168.0.173 → 143.204.191.85 TLSv1.2 105 Application Data
    6 13.002859281 192.168.0.173 → 151.101.38.132 TCP 66 57806 → 443 [ACK] Seq=228 Ack=239 Win=501 Len=0 TSval=1793202920 TSecr=191866386
    7 13.006355070 192.168.0.173 → 151.101.38.132 TLSv1.2 101 Application Data
    8 13.007704900 192.168.0.173 → 151.101.38.132 TCP 66 [TCP Dup ACK 6#1] 57806 → 443 [ACK] Seq=263 Ack=239 Win=501 Len=0 TSval=1793202925 TSecr=191866386
    9 13.031986539 192.168.0.173 → 143.204.191.85 TCP 66 38376 → 443 [ACK] Seq=105 Ack=40 Win=501 Len=0 TSval=625819075 TSecr=403133320
   10 13.121511243 192.168.0.173 → 143.204.191.85 TCP 66 38376 → 443 [ACK] Seq=105 Ack=782 Win=496 Len=0 TSval=625819165 TSecr=403133450
   11 13.125174533 192.168.0.173 → 143.204.191.85 TLSv1.2 131 Application Data
   12 13.125248037 192.168.0.173 → 143.204.191.85 TLSv1.2 869 Application Data
   13 13.412831179 192.168.0.173 → 143.204.191.85 TCP 66 38376 → 443 [ACK] Seq=973 Ack=1776 Win=501 Len=0 TSval=625819456 TSecr=403133741
   14 13.416264374 192.168.0.173 → 143.204.191.85 TLSv1.2 101 Application Data
   15 13.429302228 192.168.0.173 → 143.204.191.85 TLSv1.2 131 Application Data
   16 13.429451312 192.168.0.173 → 143.204.191.85 TLSv1.2 316 Application Data
   17 13.715081449 192.168.0.173 → 143.204.191.85 TCP 66 38376 → 443 [ACK] Seq=1323 Ack=2491 Win=501 Len=0 TSval=625819758 TSecr=403134043
   18 13.736684550 192.168.0.173 → 143.204.191.85 TLSv1.2 131 Application Data
   19 13.736793502 192.168.0.173 → 143.204.191.85 TLSv1.2 1004 Application Data
   20 14.078630543 192.168.0.173 → 143.204.191.85 TCP 66 38376 → 443 [ACK] Seq=2326 Ack=4069 Win=501 Len=0 TSval=625820122 TSecr=403134408
   21 14.124004705 192.168.0.173 → 143.204.191.85 TCP 66 38376 → 443 [ACK] Seq=2326 Ack=4100 Win=501 Len=0 TSval=625820167 TSecr=403134409
   22 18.448008177 192.168.0.173 → 13.227.211.64 TCP 66 58224 → 443 [ACK] Seq=1 Ack=1 Win=501 Len=0 TSval=2447710925 TSecr=1796794389
   23 19.814811270 192.168.0.173 → 151.101.38.132 TLSv1.2 130 Application Data
   24 19.814874192 192.168.0.173 → 151.101.38.132 TLSv1.2 190 Application Data
   25 19.828652350 192.168.0.173 → 143.204.191.85 TLSv1.2 131 Application Data
   26 19.969896666 192.168.0.173 → 151.101.38.132 TLSv1.2 101 Application Data
   27 19.977279415 192.168.0.173 → 151.101.38.132 TCP 66 [TCP Dup ACK 26#1] 57806 → 443 [ACK] Seq=486 Ack=439 Win=501 Len=0 TSval=1793209894 TSecr=191873346
   28 20.101456176 192.168.0.173 → 143.204.191.85 TCP 66 38376 → 443 [ACK] Seq=2391 Ack=4842 Win=496 Len=0 TSval=625826145 TSecr=403140431
   29 20.105260042 192.168.0.173 → 143.204.191.85 TLSv1.2 131 Application Data
   30 20.105362983 192.168.0.173 → 143.204.191.85 TLSv1.2 869 Application Data
