    1 0.000000000 192.168.1.101 → 216.58.223.197 TCP 66 43768 → 443 [ACK] Seq=1 Ack=1 Win=501 Len=0 TSval=3483976792 TSecr=79238154
    2 1.665007817 192.168.1.101 → 99.83.135.170 TLSv1.2 166 Application Data
    3 1.894687768 192.168.1.101 → 99.83.135.170 TCP 66 60492 → 443 [ACK] Seq=101 Ack=43 Win=501 Len=0 TSval=1366060646 TSecr=3229009298
    4 1.910694606 192.168.1.101 → 99.83.135.170 TCP 66 60492 → 443 [ACK] Seq=101 Ack=105 Win=501 Len=0 TSval=1366060662 TSecr=3229009313
    5 1.948795770 192.168.1.101 → 99.83.135.170 TLSv1.2 150 Application Data
    6 2.164639315 192.168.1.101 → 99.83.135.170 TCP 66 60492 → 443 [ACK] Seq=185 Ack=182 Win=501 Len=0 TSval=1366060916 TSecr=3229009568
    7 2.416976256 192.168.1.101 → 99.83.135.170 TCP 66 60492 → 443 [ACK] Seq=185 Ack=848 Win=496 Len=0 TSval=1366061168 TSecr=3229009821
    8 4.867172852 192.168.1.101 → 99.83.135.170 TLSv1.2 166 Application Data
    9 4.888691750 192.168.1.101 → 99.83.135.170 TCP 66 60492 → 443 [ACK] Seq=285 Ack=909 Win=501 Len=0 TSval=1366063640 TSecr=3229012289
   10 4.897946419 192.168.1.101 → 99.83.135.170 TCP 66 60492 → 443 [ACK] Seq=285 Ack=971 Win=501 Len=0 TSval=1366063649 TSecr=3229012289
   11 5.100571813 192.168.1.101 → 99.83.135.170 TCP 66 60492 → 443 [ACK] Seq=285 Ack=1013 Win=501 Len=0 TSval=1366063852 TSecr=3229012503
   12 5.110611557 192.168.1.101 → 99.83.135.170 TCP 66 60492 → 443 [ACK] Seq=285 Ack=1072 Win=501 Len=0 TSval=1366063862 TSecr=3229012515
   13 5.154193034 192.168.1.101 → 99.83.135.170 TLSv1.2 149 Application Data
   14 5.368711726 192.168.1.101 → 99.83.135.170 TCP 66 60492 → 443 [ACK] Seq=368 Ack=1147 Win=501 Len=0 TSval=1366064120 TSecr=3229012774
   15 5.466923769 192.168.1.101 → 99.83.135.170 TCP 66 60492 → 443 [ACK] Seq=368 Ack=1264 Win=501 Len=0 TSval=1366064218 TSecr=3229012871
   16 7.268412934 192.168.1.101 → 99.83.135.170 TLSv1.2 166 Application Data
   17 7.500646790 192.168.1.101 → 99.83.135.170 TCP 66 60492 → 443 [ACK] Seq=468 Ack=1306 Win=501 Len=0 TSval=1366066252 TSecr=3229014906
   18 7.514772356 192.168.1.101 → 99.83.135.170 TCP 66 60492 → 443 [ACK] Seq=468 Ack=1368 Win=501 Len=0 TSval=1366066266 TSecr=3229014920
   19 7.516778614 192.168.1.101 → 99.83.135.170 TCP 66 60492 → 443 [ACK] Seq=468 Ack=1411 Win=501 Len=0 TSval=1366066268 TSecr=3229014921
   20 7.517422418 192.168.1.101 → 99.83.135.170 TCP 66 60492 → 443 [ACK] Seq=468 Ack=1457 Win=501 Len=0 TSval=1366066268 TSecr=3229014921
   21 7.553558591 192.168.1.101 → 99.83.135.170 TLSv1.2 148 Application Data
   22 7.604913055 192.168.1.101 → 99.83.135.170 TLSv1.2 164 Application Data
   23 7.788392780 192.168.1.101 → 99.83.135.170 TCP 66 60492 → 443 [ACK] Seq=648 Ack=1655 Win=501 Len=0 TSval=1366066539 TSecr=3229015182
   24 7.861496097 192.168.1.101 → 99.83.135.170 TCP 66 60492 → 443 [ACK] Seq=648 Ack=1756 Win=501 Len=0 TSval=1366066613 TSecr=3229015251
   25 7.900351311 192.168.1.101 → 99.83.135.170 TLSv1.2 149 Application Data
   26 8.052746502 192.168.1.101 → 99.83.135.170 TCP 66 60492 → 443 [ACK] Seq=731 Ack=1919 Win=501 Len=0 TSval=1366066804 TSecr=3229015456
   27 8.096004272 192.168.1.101 → 99.83.135.170 TCP 66 60492 → 443 [ACK] Seq=731 Ack=1965 Win=501 Len=0 TSval=1366066847 TSecr=3229015457
   28 8.118682438 192.168.1.101 → 99.83.135.170 TCP 66 60492 → 443 [ACK] Seq=731 Ack=2041 Win=501 Len=0 TSval=1366066870 TSecr=3229015518
   29 8.253606072 192.168.1.101 → 99.83.135.170 TLSv1.2 162 Application Data
   30 8.496784909 192.168.1.101 → 99.83.135.170 TCP 66 60492 → 443 [ACK] Seq=827 Ack=2083 Win=501 Len=0 TSval=1366067248 TSecr=3229015901
